<?xml version="1.0"?>
<xs:schema xmlns:xs="http://www.w3.org/2001/XMLSchema"
	elementFormDefault="qualified">
        <xs:element name="HocBa">
        	<xs:complexType>
        		<xs:sequence>
        			<xs:element name="HoTen" type="xs:string"/>
        			<xs:element name="NgaySinh" type="xs:date"/>
        			<xs:element name="NamHoc">
        				<xs:complexType>
        					<xs:attribute name="number" type="xs:integer"/>
        					<xs:element name="Lop" type="xs:string"/>
        					<xs:element name="HocLuc" type="xs:string"/>
        					<xs:element name="HanhKiem" type="xs:string"/>
        					<xs:element name="GVCN" type="xs:string"/>
        					<xs:element name="Mons" minOccus="0" maxOccus="100">
        						<xs:complexType>
        							<xs:element name="Mon">
        								<xs:complexType>
        									<xs:attribute name="mamon" type="xs:string"/>
        									<xs:sequence>
        										<xs:element name="STT" type="xs:integer"/>
        										<xs:element name="TenMon" type="xs:string"/>
        										<xs:element name="HocKyI">
        											<xs:restriction base="float">
        												<xs:minExclusive value="0.0"/>
        												<xs:maxExclusive value="10.0"/>
        											</xs:restriction>
        										</xs:element>
        										<xs:element name="HocKyII">
        											<xs:restriction base="float">
        												<xs:minExclusive value="0.0"/>
        												<xs:maxExclusive value="10.0"/>
        											</xs:restriction>
        										</xs:element>
        										<xs:element name="CaNam">
        											<xs:restriction base="float">
        												<xs:minExclusive value="0.0"/>
        												<xs:maxExclusive value="10.0"/>
        											</xs:restriction>
        										</xs:element>
        									</xs:sequence>
        								</xs:complexType>
        							</xs:element>
        						</xs:complexType>
        					</xs:element>
        				</xs:complexType>
        			</xs:element>
        		</xs:sequence>
        	</xs:complexType>
        </xs:element>
</xs:schema>

